{
  "candidate_id": "CAND-LRT-G4E2B-MOBILE-R1",
  "pairing_revision": "litert-lm-v0.16.0-arm64-wip-r1",
  "logical_runtime": {
    "name": "litert-lm-api",
    "version": "0.16.0",
    "source_sha256": "4a790f5c56e3622891d0784c2b153e53ba2d2a140f739e8dc6bff71613b78e07",
    "license": "Apache-2.0"
  },
  "model": {
    "name": "gemma-4-E2B-it",
    "version": "6b78abd019e61a1ca4cbe3b212d2c9ce8ff38a94",
    "path": "/tmp/llm-poc-g1-arm64-001/bundle/CAND-LRT-G4E2B-MOBILE-R1/gemma-4-E2B-it.litertlm",
    "sha256": "181938105e0eefd105961417e8da75903eacda102c4fce9ce90f50b97139a63c"
  },
  "configs": {
    "ubuntu-aarch64": {"path": "poc_llm/fixtures/gate1/configs-arm64/CAND-LRT-G4E2B-MOBILE-R1.json", "sha256": "b921cde451ee59713cc2478d56292bbb326acea032c59ea3bbb66adb9653d38a"}
  },
  "quantization": "embedded mobile 2/4/8-bit mixture",
  "license": "Apache-2.0",
  "offline": true,
  "acquisition_manifest": {"path": "poc_llm/fixtures/gate1/acquisitions-arm64/ACQ-LRT-G4E2B-MOBILE-R1.json", "sha256": "c8a1a65a7d397f1337ec6d62eb5ddbff26c0c9021f6e02c562006fe8198fcd26"},
  "commands": {
    "ubuntu-aarch64": {
      "argv": ["env", "PYTHONPATH=/tmp/llm-poc-g1-arm64-001/install", "python3", "poc_llm/harness/litert_lm_child_adapter.py", "--config", "poc_llm/fixtures/gate1/configs-arm64/CAND-LRT-G4E2B-MOBILE-R1.json", "--config-sha256", "b921cde451ee59713cc2478d56292bbb326acea032c59ea3bbb66adb9653d38a"],
      "sha256": "6f762c1f03d9aefb086fbde6ff777e63b3b7abf7fb9d181d3b4c5477ffa1bda1"
    }
  }
}
